Job Title,Specialization,Required Skills,Entry Level Salary (Est),Difficulty,Job Description
Embedded Systems Engineer,Hardware,"C, C++, RTOS, ARM Architecture, I2C/SPI, Oscilloscopes",75k-95k,High,"Designs and implements software that runs on specialized hardware devices with real-time constraints."
Full Stack Developer,Software,"JavaScript, React, Node.js, SQL, Git, REST APIs, HTML/CSS",65k-90k,Medium,"Develops both the client-side and server-side logic for web applications."
VLSI Design Engineer,Hardware,"Verilog, SystemVerilog, CMOS Design, Cadence Virtuoso, ASIC, FPGA",85k-110k,Very High,"Focuses on the creation of integrated circuits by combining thousands of transistors into a single chip."
Machine Learning Engineer,Data Science,"Python, PyTorch, TensorFlow, Linear Algebra, Scikit-learn, Statistics",90k-120k,High,"Researches and builds self-learning applications and predictive models using large datasets."
DevOps Engineer,Infrastructure,"Docker, Kubernetes, AWS, CI/CD, Terraform, Linux, Shell Scripting",80k-105k,High,"Automates and integrates the processes between software development and IT teams for faster deployments."
Cybersecurity Analyst,Networks,"Network Security, Wireshark, SIEM tools, Penetration Testing, Linux, Cryptography",70k-95k,Medium,"Monitors and protects an organization's computer networks and systems from security breaches."
FPGA Design Engineer,Hardware,"VHDL, Verilog, Vivado, Quartus, Digital Logic Design, Signal Processing",80k-100k,High,"Programs programmable logic devices to implement complex digital circuits and high-speed data processing."
Backend Engineer,Software,"Java, Spring Boot, Go, PostgreSQL, Redis, Microservices, Docker",75k-100k,Medium,"Builds the server-side logic and database interactions that power the functional part of an application."
Data Engineer,Data Science,"SQL, Spark, Hadoop, Python, ETL Pipelines, Airflow, Data Warehousing",80k-110k,High,"Constructs and maintains the systems and architecture that allow for large-scale data processing and analysis."
Robotics Software Engineer,Hardware,"C++, ROS, SLAM, Python, Computer Vision, Kinematics, Control Theory",85k-115k,Very High,"Develops the software that allows robots to perceive their environment and perform autonomous movements."
SRE (Site Reliability Engineer),Infrastructure,"Python, Linux, Incident Management, Monitoring Tools, Distributed Systems, Go",85k-110k,High,"Applies software engineering principles to operations to ensure system reliability and uptime."
Cloud Architect,Infrastructure,"AWS/Azure/GCP, Networking, IAM, Cloud Security, Serverless, Infrastructure as Code",90k-125k,High,"Designs the high-level structure and deployment strategies for cloud-based computing resources."
Frontend Engineer,Software,"TypeScript, CSS, Vue.js, Webpack, Responsive Design, Testing Frameworks",60k-85k,Medium,"Translates UI/UX designs into functional and interactive user interfaces for web applications."
Firmware Engineer,Hardware,"C, Assembly, Microcontrollers, Bootloaders, Debugging, Hardware Interfacing",75k-98k,High,"Writes low-level code that resides on non-volatile memory chips to control hardware devices."
Network Architect,Networks,"BGP, OSPF, Cisco IOS, SDN, Network Topology, Security Protocols",85k-115k,High,"Designs and builds local area networks, wide area networks, and Intranets for large organizations."
Mobile App Developer (iOS),Software,"Swift, SwiftUI, Xcode, Cocoa Touch, App Store Guidelines, REST APIs",70k-95k,Medium,"Creates and optimizes applications specifically for Apple's mobile operating systems."
Computer Vision Engineer,Data Science,"OpenCV, Python, Deep Learning, Image Processing, C++, PyTorch",90k-125k,Very High,"Develops algorithms that allow computers to extract high-level understanding from digital images or videos."
Hardware Verification Engineer,Hardware,"SystemVerilog, UVM, Scripting (Perl/Python), Logic Design, Simulation Tools",80k-105k,Very High,"Ensures that integrated circuit designs meet their specifications before physical manufacturing."
SOC (Security Operations Center) Analyst,Networks,"Log Analysis, Threat Hunting, TCP/IP, IDS/IPS, Malware Analysis",65k-85k,Medium,"Operates as the first line of defense in monitoring and responding to security alerts in real-time."
Database Administrator,Software,"SQL Server, Oracle, Database Tuning, Backup & Recovery, Scripting, Security",70k-95k,Medium,"Manages and maintains database environments to ensure data integrity and accessibility."
Game Engine Developer,Software,"C++, OpenGL/Vulkan, Math for Games, Shaders, Memory Management, Physics Engines",80k-110k,Very High,"Builds the core technology and rendering pipelines that power video games."
Technical Writer,Design,"Markdown, API Documentation, Technical Editing, Jira, Git, Software Concepts",55k-75k,Low,"Creates clear and concise documentation for software products and engineering processes."
PLC Programmer,Hardware,"Ladder Logic, Structured Text, HMI, SCADA, Industrial Automation, Electrical Diagrams",60k-85k,Medium,"Programs Programmable Logic Controllers used in industrial manufacturing and automation."
Product Manager (Technical),Management,"Agile, Roadmapping, Market Analysis, UX Design, SQL, Communication Skills",85k-110k,Medium,"Leads the development strategy and feature prioritization for a technical product."
Blockchain Engineer,Software,"Solidity, Rust, Cryptography, P2P Networking, Smart Contracts, Consensus Algorithms",95k-135k,Very High,"Designs and develops decentralized applications and systems using distributed ledger technology."
AI Research Scientist,Data Science,"Mathematics, Statistics, Deep Learning, Reinforcement Learning, Research Papers, Python",100k-140k,Very High,"Conducts advanced research to push the boundaries of artificial intelligence and algorithmic theory."
Systems Architect,Infrastructure,"System Design, Scalability, Virtualization, Enterprise Architecture, API Design",95k-130k,High,"Defines the high-level structure and technical standards for complex enterprise-level systems."
Digital Signal Processing (DSP) Engineer,Hardware,"MATLAB, C, Assembly, Filter Design, FFT, Discrete Mathematics, Wireless Systems",85k-110k,Very High,"Analyzes and modifies signals to improve their efficiency or quality in telecommunications and audio."
QA Automation Engineer,Software,"Selenium, Cypress, Python, Test Plans, Jenkins, Load Testing",60k-85k,Medium,"Develops automated scripts and frameworks to test software functionality and performance."
Sales Engineer,HR,"Presentation Skills, Technical Support, CRM, Sales Strategy, Networking Concepts",70k-95k,Low,"Acts as a technical resource for sales teams to explain complex products to potential customers."
IT Project Manager,Management,"PMP, Agile/Scrum, Budgeting, Risk Management, Stakeholder Management",75k-100k,Medium,"Oversees the planning, execution, and delivery of Information Technology projects within an organization."
AppSec (Application Security) Engineer,Networks,"OWASP Top 10, Code Review, DAST/SAST, Penetration Testing, Python",85k-115k,High,"Focuses on identifying and mitigating security vulnerabilities within the software code and architecture."
Bioinformatics Developer,Data Science,"Python, R, Genomics, Biological Databases, Statistics, Sequence Alignment",75k-105k,High,"Develops software tools and algorithms for analyzing and interpreting complex biological data."
Control Systems Engineer,Hardware,"MATLAB/Simulink, Control Theory, Sensors, Actuators, Embedded C, PID Control",75k-95k,High,"Designs systems that regulate the behavior of machines and processes using feedback loops."
UI Designer,Design,"Figma, Adobe XD, Typography, Color Theory, Prototyping, Wireframing",55k-80k,Low,"Focuses on the visual aspects and interactive elements of a software application's interface."
Technical Recruiter,HR,"Sourcing, Interviewing, Technical Understanding, LinkedIn Recruiter, Communication",50k-70k,Low,"Finds and evaluates technical talent for engineering and technology organizations."
Linux Kernel Developer,Software,"C, Operating Systems, File Systems, Kernel Internals, Drivers, Memory Management",90k-130k,Very High,"Contributes to or modifies the core code of the Linux operating system."
IoT (Internet of Things) Architect,Infrastructure,"MQTT, CoAP, Wireless Protocols, Cloud Integration, Embedded Systems, Security",85k-115k,High,"Designs the end-to-end architecture for connected device ecosystems from sensors to cloud."
Data Scientist,Data Science,"Python, R, Statistics, Data Visualization, SQL, Hypothesis Testing",85k-115k,Medium,"Analyzes and interprets complex data to help organizations make informed business decisions."
Computer Hardware Engineer,Hardware,"Circuit Design, PCB Layout, Prototyping, Signal Integrity, Thermal Management",70k-90k,High,"Designs, develops, and tests physical components of computers and other electronic systems."
Site Reliability Engineer (SRE),Infrastructure,"Linux, Go, Terraform, Kubernetes, Observability, Scripting",85k-110k,High,"Ensures that large-scale systems remain reliable and efficient through automation and engineering."
AR/VR Developer,Software,"Unity, Unreal Engine, C#, C++, 3D Mathematics, Spatial Audio",75k-100k,High,"Creates immersive applications for Augmented Reality and Virtual Reality platforms."
Microfluidics Engineer,Hardware,"MEMS, CAD, Fluid Dynamics, Lab-on-a-Chip, Cleanroom Processes",80k-105k,Very High,"Designs devices that manipulate small volumes of fluids, often for medical or chemical analysis."
SOC Verification Engineer,Hardware,"UVM, SystemVerilog, Assertions, Functional Coverage, Regression Testing",85k-110k,Very High,"Tests the integration of multiple components on a single System-on-Chip design."
Network Security Engineer,Networks,"Firewalls, VPNs, IDS/IPS, Network Protocols, Encryption, Risk Assessment",75k-100k,High,"Designs and implements security measures to protect network infrastructure from unauthorized access."
Scrum Master,Management,"Agile Methodologies, Coaching, Facilitation, Jira, Conflict Resolution",70k-90k,Low,"Facilitates the agile development process for software teams by removing obstacles and ensuring adherence to Scrum."
Mobile App Developer (Android),Software,"Kotlin, Java, Android Studio, Material Design, Jetpack Compose, APIs",70k-95k,Medium,"Develops and optimizes applications for the Android operating system and ecosystem."
Storage Engineer,Infrastructure,"SAN, NAS, RAID, Storage Protocols (iSCSI/FC), Backup Solutions",75k-100k,Medium,"Manages and optimizes data storage hardware and software for enterprise environments."
Test Engineer (Hardware),Hardware,"Test Plans, LabVIEW, Python, Bench Testing, RF Measurements",65k-85k,Medium,"Designs and executes tests to ensure hardware components meet performance and quality standards."
GIS (Geographic Information Systems) Developer,Software,"Python, ArcGIS, PostGIS, Spatial Data, JavaScript, Geoprocessing",65k-90k,Medium,"Develops software that captures, stores, and analyzes geographic and spatial data."
Game Designer,Design,"Mechanics Design, Level Design, Storyboarding, Prototyping, GDD Creation",55k-85k,Low,"Develops the rules, systems, and gameplay experiences of video games."
IT Auditor,Management,"CISA, Risk Assessment, IT Governance, Compliance, Internal Controls",65k-90k,Medium,"Examines and evaluates an organization's information technology infrastructure and policies."
Information Security Manager,Management,"CISM, Risk Management, Security Policy, Compliance, Leadership",95k-130k,Medium,"Oversees an organization's overall information security strategy and program."
Embedded Linux Engineer,Hardware,"Yocto, Buildroot, Device Drivers, U-Boot, C, Kernel Patching",85k-110k,High,"Customizes and deploys Linux distributions for embedded hardware platforms."
Cloud Security Engineer,Networks,"IAM, CloudTrail, Encryption, Network Security, AWS Security Hub, Python",85k-115k,High,"Secures cloud-based infrastructure and data from threats and misconfigurations."
NLP (Natural Language Processing) Engineer,Data Science,"Python, NLTK, Transformers, BERT, Linguistics, Deep Learning",90k-125k,High,"Builds systems that allow computers to understand and process human language."
AutoCAD Designer,Design,"2D Drafting, 3D Modeling, Engineering Standards, Technical Drawing",50k-70k,Low,"Creates detailed technical drawings and plans using computer-aided design software."
Performance Engineer,Software,"Profiling Tools, Java/C++, Load Testing, System Architecture, JVM Tuning",80k-110k,High,"Focuses on optimizing software speed, scalability, and resource utilization."
Autonomous Vehicle Engineer,Hardware,"Lidar, Radar, C++, Kalman Filters, Path Planning, Deep Learning",95k-135k,Very High,"Develops the navigation and perception systems for self-driving cars and drones."
Web Architect,Software,"System Design, Scalability, Caching, CDN, API Strategy, Cloud Native",95k-130k,High,"Defines the technical vision and structural design for complex web-based ecosystems."
Penetration Tester,Networks,"Metasploit, Burp Suite, Python, Kali Linux, Exploit Development",80k-110k,High,"Authorized security professional who probes systems for vulnerabilities through simulated attacks."
ERP Consultant,Management,"SAP/Oracle ERP, Business Process, SQL, Requirements Gathering, Project Management",70k-95k,Medium,"Helps organizations implement and customize Enterprise Resource Planning software systems."
Digital Forensics Examiner,Networks,"EnCase, File Systems, Chain of Custody, Data Recovery, Legal Knowledge",70k-95k,High,"Investigates digital crimes and recovers data from electronic devices for legal purposes."
Systems Programmer,Software,"C, C++, Assembly, Operating Systems, Memory Management, Compiler Design",85k-120k,Very High,"Writes software that provides services to other software or manages system hardware."
Robotics Process Automation (RPA) Developer,Software,"UiPath, Blue Prism, Automation Anywhere, .NET, SQL, Process Mapping",65k-90k,Low,"Builds software robots to automate repetitive business tasks and workflows."
Computer Forensic Analyst,Networks,"Network Analysis, Incident Response, Cryptography, Scripting, Forensic Tools",75k-100k,High,"Analyzes network traffic and system logs to investigate security incidents and data breaches."
PCB Layout Engineer,Hardware,"Altium Designer, Allegro, High-Speed Design, Signal Integrity, Manufacturing (CAM)",70k-90k,Medium,"Designs the physical layout of printed circuit boards based on electronic schematics."
Infrastructure Engineer,Infrastructure,"Linux, Networking, Virtualization, Storage, Automation, Hardware Maintenance",75k-100k,Medium,"Builds and maintains the underlying hardware and software foundation of an IT environment."
Solution Architect,Management,"Cloud, API Design, Pre-sales, Architecture Patterns, Communication",90k-125k,Medium,"Designs specific technical solutions to meet business requirements and solves customer problems."
Machine Vision Scientist,Data Science,"Image Processing, Deep Learning, Mathematics, Python, C++, Research",100k-140k,Very High,"Conducts research on advanced algorithms for visual perception and automated inspection."
Quantitative Developer,Software,"C++, Python, Statistics, Financial Modeling, High-Frequency Trading, Linux",100k-150k,Very High,"Develops software for complex mathematical models used in finance and trading."
Security Architect,Networks,"Network Security Design, Cryptography, IAM, Compliance Frameworks, Threat Modeling",100k-135k,High,"Designs robust security structures that protect organizational assets across the enterprise."
Data Architect,Data Science,"Data Modeling, ETL, SQL, NoSQL, Master Data Management, Big Data",95k-130k,High,"Designs the blueprint for managing an organization's data assets and data flow."
Integration Developer,Software,"MuleSoft, Dell Boomi, APIs, XML/JSON, Web Services, Java",70k-95k,Medium,"Builds connections between disparate software systems to allow for seamless data exchange."
Release Engineer,Infrastructure,"Jenkins, Maven, Git, CI/CD, Scripting, Configuration Management",70k-95k,Medium,"Manages the process of compiling, assembling, and delivering software releases."
Signal Integrity Engineer,Hardware,"HyperLynx, Spice, High-Speed Design, Electromagnetics, PCB Design",85k-115k,Very High,"Ensures that electrical signals maintain their quality as they travel through high-speed circuits."
Wireless Communications Engineer,Hardware,"LTE/5G, RF Engineering, Signal Processing, OFDM, Network Protocols",85k-115k,High,"Designs and optimizes wireless communication systems and network infrastructure."
Ethical Hacker,Networks,"OWASP, Network Security, Python, Bash, Web Security, Vulnerability Scanning",80k-110k,High,"Identifies and fixes security vulnerabilities in systems before malicious actors can exploit them."
Platform Engineer,Infrastructure,"Kubernetes, Go, AWS/GCP, Internal Developer Platforms, Automation",85k-115k,High,"Builds and maintains internal platforms that enable developers to deploy and run applications easily."
Mobile Architect,Software,"App Architecture Patterns, Performance, Security, Multi-platform Strategy, Lead Engineering",100k-140k,High,"Sets the high-level technical direction and structural standards for mobile applications."
Compiler Engineer,Software,"LLVM, C++, Assembly, Formal Languages, Optimization, Static Analysis",95k-135k,Very High,"Designs and implements software that translates high-level code into machine instructions."
Cryptographer,Networks,"Mathematics, Number Theory, C/C++, Security Protocols, Algorithmic Analysis",100k-140k,Very High,"Develops and analyzes mathematical algorithms to secure communication and data."
Mainframe Systems Programmer,Software,"z/OS, COBOL, JCL, Assembler, Database Management, System Tuning",80k-110k,High,"Maintains and manages large-scale mainframe computing environments for enterprises."
Computer Graphics Engineer,Software,"OpenGL, Vulkan, C++, Linear Algebra, Shaders, Ray Tracing",85k-120k,Very High,"Develops software that generates and manipulates visual images and animations."
Telecommunications Engineer,Networks,"Fiber Optics, Switching, Network Routing, VoIP, Cellular Networks",70k-95k,Medium,"Designs and manages voice, video, and data communication systems."
Virtualization Engineer,Infrastructure,"VMware, Hyper-V, KVM, Cloud Management, Scripting, Storage",75k-100k,Medium,"Manages and optimizes virtual machine environments and hypervisor software."
Functional Safety Engineer,Hardware,"ISO 26262, Risk Analysis, FMEA, Embedded Systems, Safety Standards",85k-110k,High,"Ensures that electronic systems in safety-critical applications like automotive perform reliably."
System Administrator,Infrastructure,"Linux/Windows, Active Directory, Networking, Scripting, Hardware Troubleshooting",60k-85k,Medium,"Installs, supports, and maintains computer systems and servers for an organization."
Big Data Engineer,Data Science,"Kafka, Spark, Scala, Hadoop, Hive, Python",90k-120k,High,"Develops and manages large-scale data processing systems using big data technologies."
Application Support Engineer,Software,"SQL, Linux, Scripting, Troubleshooting, Log Analysis, Communication",55k-80k,Low,"Provides technical support and troubleshooting for software applications in production."
Network Controller,Networks,"Network Monitoring, NOC, Troubleshooting, Routing, Switching",60k-85k,Medium,"Monitors and manages the day-to-day operations of a large computer network."
ASIC Physical Design Engineer,Hardware,"Floorplanning, Place and Route, Timing Closure, Cadence Innovus, DRC/LVS",90k-120k,Very High,"Handles the physical implementation of integrated circuits from netlist to final tape-out."
Technical Support Engineer,HR,"Problem Solving, Networking, OS Knowledge, Customer Service, Scripting",50k-75k,Low,"Solves complex technical issues for customers using a company's software or hardware products."
Configuration Manager,Management,"Git, Version Control, Build Automation, Documentation, Audit Tools",65k-90k,Low,"Ensures that software and hardware assets are documented and their changes are tracked."
Business Systems Analyst,Management,"Requirements Elicitation, SQL, Process Modeling, Communication, Stakeholder Management",65k-90k,Medium,"Analyzes business processes and translates them into technical requirements for IT systems."
IT Compliance Officer,Management,"GDPR, HIPAA, SOC2, Audit, Policy Creation, Risk Management",70k-95k,Medium,"Ensures that an organization's IT systems and processes meet legal and regulatory requirements."
Hardware Architect,Hardware,"System Design, CPU Architecture, Performance Modeling, Memory Hierarchy, ISA",110k-150k,Very High,"Defines the high-level architecture and specifications for future hardware systems."
Frontend Architect,Software,"Design Systems, Performance Optimization, Scalable CSS, JS Frameworks, Web Standards",100k-140k,High,"Sets the technical vision and structural design for complex user interface systems."
Developer Advocate,HR,"Public Speaking, Technical Writing, Community Management, Coding (Various), API Experience",80k-110k,Low,"Serves as a bridge between a company's engineering team and the external developer community."
Hardware Reliability Engineer,Hardware,"HALT/HASS, Failure Analysis, Physics of Failure, Statistics, Environmental Testing",75k-100k,High,"Evaluates and improves the durability and lifespan of hardware components and systems."